{"addedPaths":[{"class":"PLATFORM-CONTRACT","mutationWindows":["A0-P3"],"path":"apps/hub/src/http/app.ts","sourceRef":"4F-A0#http-composition","transitionRef":"A0-T02","transitionRole":"OUTPUT"},{"class":"PLATFORM-CONTRACT","mutationWindows":["A0-P3"],"path":"apps/hub/src/http/problem.ts","sourceRef":"4F-A0#problem-details","transitionRef":"A0-T02","transitionRole":"OUTPUT"},{"class":"PLATFORM-CONTRACT","mutationWindows":["A0-P3"],"path":"apps/hub/src/identity-access/errors.ts","sourceRef":"4F-A0#identity-errors","transitionRef":"A0-T02","transitionRole":"OUTPUT"},{"class":"PLATFORM-CONTRACT","mutationWindows":["A0-P3"],"path":"apps/hub/src/identity-access/module.ts","sourceRef":"4F-A0#identity-module","transitionRef":"A0-T02","transitionRole":"OUTPUT"},{"class":"PLATFORM-CONTRACT","mutationWindows":["A0-P3"],"path":"apps/hub/src/identity-access/routes.ts","sourceRef":"4F-A0#identity-routes","transitionRef":"A0-T02","transitionRole":"OUTPUT"},{"class":"PLATFORM-CONTRACT","mutationWindows":["A0-P3"],"path":"apps/hub/src/platform/config.ts","sourceRef":"4F-A0#platform-config","transitionRef":"A0-T02","transitionRole":"OUTPUT"},{"class":"PLATFORM-CONTRACT","mutationWindows":["A0-P3"],"path":"apps/hub/src/platform/postgres.ts","sourceRef":"4F-A0#platform-postgres","transitionRef":"A0-T02","transitionRole":"OUTPUT"},{"class":"PLATFORM-CONTRACT","mutationWindows":["A0-P1"],"path":"apps/hub/tsconfig.json","sourceRef":"4F-A0#hub-strict-types"},{"class":"PLATFORM-CONTRACT","mutationWindows":["A0-P1"],"path":"apps/web/tsconfig.json","sourceRef":"4F-A0#web-strict-types"},{"class":"PLATFORM-CONTRACT","mutationWindows":["A0-P4"],"path":"biome.json","sourceRef":"4F-A0#biome"},{"class":"PLATFORM-CONTRACT","mutationWindows":["A0-P1"],"path":"docs/evidence/4d/4d-r1-a0-foundation-pin-manifest.json","sourceRef":"4F-A0#foundation-type-admission"},{"class":"PLATFORM-CONTRACT","mutationWindows":["A0-P2"],"path":"packages/canonical-json/src/index.d.mts","sourceRef":"4F-A0#canonical-json-types","transitionRef":"A0-T01","transitionRole":"OUTPUT"},{"class":"PLATFORM-CONTRACT","mutationWindows":["A0-P2"],"path":"packages/canonical-json/src/index.mjs","sourceRef":"4F-A0#canonical-json-runtime","transitionRef":"A0-T01","transitionRole":"OUTPUT"},{"class":"PLATFORM-CONTRACT","mutationWindows":["A0-P4"],"path":"scripts/check-import-law.mjs","sourceRef":"4F-A0#import-law"},{"class":"PLATFORM-CONTRACT","mutationWindows":["A0-P5"],"path":"scripts/record-r1-a0-receipt.mjs","sourceRef":"4F-A0#receipt-last"},{"class":"PLATFORM-CONTRACT","mutationWindows":["A0-P1"],"path":"tests/implementation/r1-a0-admission.test.mjs","sourceRef":"4F-A0#type-admission-proof"},{"class":"PLATFORM-CONTRACT","mutationWindows":["A0-P4"],"path":"tests/repository/import-law.test.mjs","sourceRef":"4F-A0#import-law-red"},{"class":"PLATFORM-CONTRACT","mutationWindows":["A0-P1"],"path":"tsconfig.base.json","sourceRef":"4F-A0#strict-type-base"}],"adoptedExistingPaths":[{"class":"PLATFORM-CONTRACT","mutationLaw":"REPLACE","mutationWindows":["A0-P2"],"path":"packages/profile-compiler/src/admission.mjs","preDigest":"468f16aee0a13d7f61230a3e51837b7d935c003716be75446f2315add1b8ee93","sourceRef":"4D-G0-PASS#compiler-admission","transitionRef":"A0-T01","transitionRole":"INPUT_OUTPUT"},{"class":"PLATFORM-CONTRACT","mutationLaw":"REPLACE","mutationWindows":["A0-P2"],"path":"packages/profile-compiler/src/compiler.mjs","preDigest":"094800afcb85619ff152322d19c38cf22519ac9d1fff0aadd06e79bcbf1844a6","sourceRef":"4D-G0-PASS#profile-compiler"},{"class":"PLATFORM-CONTRACT","mutationLaw":"REPLACE","mutationWindows":["A0-P2"],"path":"packages/profile-compiler/src/index.mjs","preDigest":"b1e7805732b90761d96080c2ef3b33573b0a287eb4de9a225d66b25b72c578c5","sourceRef":"4D-G0-PASS#profile-compiler-entry"},{"class":"PLATFORM-CONTRACT","mutationLaw":"REPLACE","mutationWindows":["A0-P2"],"path":"scripts/generate-r1-g0.mjs","preDigest":"87c9d9a016c6aa4e6f802ad0572f131a2add7bd983f207050493ec7d9269077d","sourceRef":"4D-G0-PASS#generator"},{"class":"PLATFORM-CONTRACT","mutationLaw":"REPLACE","mutationWindows":["A0-P3"],"path":"scripts/generate-r1-s1-contracts.mjs","preDigest":"6f6b165cbf10b877cf918bcb1caeed9d3cf3966da48019d45b6926f32b24b303","sourceRef":"4D-S1-PASS#contract-generator"},{"class":"PLATFORM-CONTRACT","mutationLaw":"REPLACE","mutationWindows":["A0-P3"],"path":"scripts/record-r1-s1-receipt.mjs","preDigest":"11e00dc76ab10a8b33d8151d2fbaabae38cff5290e8c1d345e11dc900fe4187d","sourceRef":"4D-S1-PASS#receipt-check"},{"class":"PLATFORM-CONTRACT","mutationLaw":"REPLACE","mutationWindows":["A0-P2"],"path":"tests/implementation/r1-g0-profile-compiler.test.mjs","preDigest":"cd0b365e09ee5068ff6fa90959d6eba47bae626b011e15dcdbf4f043804889d8","sourceRef":"4D-G0-PASS#qualification"},{"class":"PLATFORM-CONTRACT","mutationLaw":"REPLACE","mutationWindows":["A0-P3"],"path":"tests/implementation/r1-s1-http.test.mjs","preDigest":"621ed309ce9a4e6909fcf55046e7c39346a4eb259cfe8fbfe3883200f7d24aae","sourceRef":"4D-S1-PASS#http-proof"},{"class":"PLATFORM-CONTRACT","mutationLaw":"REPLACE","mutationWindows":["A0-P3","A0-P5"],"path":"tests/implementation/r1-s1-live-runner.sh","preDigest":"f0a63a0cb13bc0373ef6d2d59b056488f288eab013f97fdafd79953bf8bf0ffa","sourceRef":"4D-S1-PASS#live-runner"},{"class":"PLATFORM-CONTRACT","mutationLaw":"REPLACE","mutationWindows":["A0-P3"],"path":"tests/implementation/r1-s1-live-setup.mjs","preDigest":"49300a9dfcb5ce2106221076a6f2944a366516bcb2cb9fd37135b06038124b6b","sourceRef":"4D-S1-PASS#live-setup"},{"class":"PLATFORM-CONTRACT","mutationLaw":"REPLACE","mutationWindows":["A0-P3"],"path":"tests/implementation/r1-s1-postgres.test.mjs","preDigest":"42eec699f104760ee35c78615596026d06a7bdc819bfb822768e9a3149e40591","sourceRef":"4D-S1-PASS#postgres-proof"},{"class":"PLATFORM-CONTRACT","mutationLaw":"REPLACE","mutationWindows":["A0-P3","A0-P5"],"path":"tests/implementation/r1-s1-qualification-runner.sh","preDigest":"9689bbb1c69ba68d470783b0c4dd6b7e1b08114660f4a0c555435280d8aa011f","sourceRef":"4D-S1-PASS#qualification-runner"}],"affectedClaims":["G0 deterministic profile compilation and receipt remain exact","S1 IAM-01..03 behavior and Product OpenAPI remain exact","A0 code architecture changes zero Product semantics","A0 successor admission is receipt-last"],"bootstrapPaths":[{"class":"PLATFORM-CONTRACT","outputDigest":"f98dfb9e3b8b1272ae640b3af1bcf2c9f8ff3fcc3aea3c4bbab3f520553af7ee","path":"packages/profile-compiler/schemas/a0-code-architecture-migration.schema.json","sourceRef":"4F-A0#custody-schema"},{"class":"PLATFORM-CONTRACT","outputDigest":"3ad57b7d8dc2913fd711e2d9a6615262fa4acfbc8d1598666eba1c034466cc11","path":"scripts/check-r1-a0-bootstrap.mjs","sourceRef":"4F-A0#bootstrap-digest-check"},{"class":"PLATFORM-CONTRACT","outputDigest":"f5be91477c349f7a38a94ffc54bcb10e1c47a04b836fd532c64d48bd6e5d5f8c","path":"scripts/check-r1-a0-migration.mjs","sourceRef":"4F-A0#migration-validator"},{"class":"PLATFORM-CONTRACT","outputDigest":"fd6f48a50ac615fd6f71b60ce0202400c89c6dab3c1ee662f04584b04b73be1c","path":"scripts/record-r1-a0-part-pass.mjs","sourceRef":"4F-A0#part-pass-recorder"},{"class":"PLATFORM-CONTRACT","outputDigest":"4573e7b851963fdf05812b55a7f935e9f676cfe67cfaa8901652d327a9304b0a","path":"tests/implementation/r1-a0-migration-custody.test.mjs","sourceRef":"4F-A0#custody-red-controls"}],"changedPaths":[{"class":"PLATFORM-CONTRACT","mutationWindows":["A0-P1"],"path":"package-lock.json","priorDigest":"8997f4d37274d856c89f2be3fd36e5ee048c11d1e77068482567e9f46d2c1bcc","sourceRef":"4F-A0#foundation-type-admission"},{"class":"PLATFORM-CONTRACT","mutationWindows":["A0-P1"],"path":"package.json","priorDigest":"a57434b870f66db758ef9fc0d4c6e04c5ef8590b0eab1ec250485af72a608dc6","sourceRef":"4F-A0#foundation-type-admission"}],"controlArtifacts":[{"kind":"conexus.r1-a0-code-architecture-migration/v1","path":"profiles/r1/v1/a0-code-architecture-migration.json","publicationPhase":"BOOTSTRAP"},{"kind":"conexus.r1-a0-migration-plan-validation/v1","path":"runtime/r1/.conexus/a0-migration-plan-validation.json","publicationPhase":"BOOTSTRAP"},{"kind":"conexus.r1-a0-part-pass/v1","path":"runtime/r1/.conexus/a0-p1-pass.json","publicationPhase":"A0-P1"},{"kind":"conexus.r1-a0-part-pass/v1","path":"runtime/r1/.conexus/a0-p2-pass.json","publicationPhase":"A0-P2"},{"kind":"conexus.r1-a0-part-pass/v1","path":"runtime/r1/.conexus/a0-p3-pass.json","publicationPhase":"A0-P3"},{"kind":"conexus.r1-a0-part-pass/v1","path":"runtime/r1/.conexus/a0-p4-pass.json","publicationPhase":"A0-P4"},{"kind":"conexus.r1-a0-part-pass/v1","path":"runtime/r1/.conexus/a0-p5-pass.json","publicationPhase":"A0-P5"},{"kind":"conexus.r1-a0-conformance-result/v1","path":"runtime/r1/.conexus/a0-conformance-result.json","publicationPhase":"A0-P5"},{"kind":"conexus.r1-a0-ownership-manifest/v1","path":"runtime/r1/.conexus/a0-ownership-manifest.json","publicationPhase":"A0-P5"},{"kind":"conexus.r1-a0-generation-receipt/v1","path":"runtime/r1/.conexus/a0-generation-receipt.json","publicationPhase":"A0-P5"}],"custodyScope":{"exactFiles":[".nvmrc","biome.json","docs/evidence/4d/4d-r1-a0-foundation-pin-manifest.json","docs/evidence/4d/4d-r1-foundation-pin-manifest.json","package-lock.json","package.json","scripts/check-import-law.mjs","scripts/check-r1-a0-bootstrap.mjs","scripts/check-r1-a0-migration.mjs","scripts/generate-r1-g0.mjs","scripts/generate-r1-s1-contracts.mjs","scripts/record-r1-a0-receipt.mjs","scripts/record-r1-a0-part-pass.mjs","scripts/record-r1-s1-receipt.mjs","tests/repository/import-law.test.mjs","tsconfig.base.json"],"recursiveRoots":["apps/hub","apps/web","contracts/api/product","packages/canonical-json","packages/profile-compiler","profiles/r1/v1","runtime/r1","tests/implementation"]},"dependencyTargets":[{"class":"DEV","integrity":"sha512-fKVHpikPdg4GKks3JuLEhvwSyvwzF23hnabPy6DD8ljVbC7+6J5dQzdv4arV6jqq57djnMgs1HKBxX4P8aBI3A==","name":"@types/pg","priorState":"ABSENT","version":"8.23.1"}],"expectedProductDelta":{"durableRecordClas